{
  "$schema": "https://json-schema.org/draft/2020-12/schema",
  "$id": "#/components/schemas/ContactFlow",
  "title": "ContactFlow",
  "type": "object",
  "description": "Contains information about a contact flow.",
  "properties": {
    "Arn": {
      "type": "string",
      "description": "The Amazon Resource Name (ARN) of the contact flow."
    },
    "Id": {
      "type": "string",
      "description": "The identifier of the contact flow.",
      "example": "a1b2c3d4-5678-90ab-cdef-77777EXAMPLE"
    },
    "Name": {
      "type": "string",
      "description": "The name of the contact flow."
    },
    "Type": {
      "type": "string",
      "description": "The type of the contact flow."
    },
    "State": {
      "type": "string",
      "description": "The state of the contact flow.",
      "enum": [
        "ACTIVE",
        "ARCHIVED"
      ]
    },
    "Description": {
      "type": "string",
      "description": "The description of the contact flow."
    },
    "Content": {
      "type": "string",
      "description": "The content of the contact flow."
    },
    "Tags": {
      "type": "object",
      "additionalProperties": {
        "type": "string"
      }
    }
  }
}